{
  "schema_version": 1,
  "id": "coela-engineering-delivery",
  "version": "1.1.0",
  "interfaces": [
    {
      "id": "portable-plugin",
      "owner": "https://github.com/coela-oss/engineering",
      "native_sources": [
        {
          "path": "integrations/plugin/plugin.json",
          "sha256": "d498c44f2ed2c3c2deb0ed9ee7ab87d40c0a6b2ab50adfe408e6f7ddba298fa9"
        },
        {
          "path": "src/plugin.mts",
          "sha256": "3b096caee2857b32fdbf101d68389c354b0ddef7d2a3f1844dadab92488be355"
        }
      ],
      "identity": [
        "/name"
      ],
      "fields": [
        {
          "name": "/$schema",
          "type": "string",
          "required": true
        },
        {
          "name": "/name",
          "type": "string",
          "required": true
        },
        {
          "name": "/version",
          "type": "string",
          "required": true
        },
        {
          "name": "/description",
          "type": "string",
          "required": true
        },
        {
          "name": "/author/name",
          "type": "string",
          "required": true
        },
        {
          "name": "/author/url",
          "type": "string",
          "required": true
        },
        {
          "name": "/homepage",
          "type": "string",
          "required": true
        },
        {
          "name": "/repository",
          "type": "string",
          "required": true
        },
        {
          "name": "/license",
          "type": "string",
          "required": true
        }
      ],
      "consumers": [
        {
          "id": "plugin-package",
          "owner": "https://github.com/coela-oss/engineering",
          "fields": [
            {
              "name": "/$schema",
              "support": "required"
            },
            {
              "name": "/name",
              "support": "required"
            },
            {
              "name": "/version",
              "support": "required"
            },
            {
              "name": "/description",
              "support": "required"
            },
            {
              "name": "/author/name",
              "support": "required"
            },
            {
              "name": "/author/url",
              "support": "required"
            },
            {
              "name": "/homepage",
              "support": "required"
            },
            {
              "name": "/repository",
              "support": "required"
            },
            {
              "name": "/license",
              "support": "required"
            }
          ]
        }
      ]
    },
    {
      "id": "web-guidance",
      "owner": "https://github.com/coela-oss/engineering",
      "native_sources": [
        {
          "path": "src/content.mts",
          "sha256": "349c15491d1e5722e68b126ccd257ae8ed7d7e96b14902d26c15103e1e020abc"
        },
        {
          "path": "src/projections.mts",
          "sha256": "1ec99543e1fd3845a740f35f26c2635f26461ac906f540b332eee6da13b078d2"
        }
      ],
      "identity": [
        "/contentId"
      ],
      "fields": [
        {
          "name": "/catalogId",
          "type": "string",
          "required": true
        },
        {
          "name": "/version",
          "type": "string",
          "required": true
        },
        {
          "name": "/catalogSha256",
          "type": "string",
          "required": true
        },
        {
          "name": "/contentId",
          "type": "string",
          "required": true
        },
        {
          "name": "/contentSha256",
          "type": "string",
          "required": true
        },
        {
          "name": "/locale",
          "type": "string",
          "required": true
        },
        {
          "name": "/license",
          "type": "string",
          "required": true
        },
        {
          "name": "/attribution",
          "type": "string",
          "required": true
        },
        {
          "name": "/source",
          "type": "string",
          "required": true
        },
        {
          "name": "/title",
          "type": "string",
          "required": true
        },
        {
          "name": "/excerpt",
          "type": "string",
          "required": true
        }
      ],
      "consumers": [
        {
          "id": "portfolio",
          "owner": "https://github.com/coela-oss/portfolio",
          "fields": [
            {
              "name": "/catalogId",
              "support": "required"
            },
            {
              "name": "/version",
              "support": "required"
            },
            {
              "name": "/catalogSha256",
              "support": "required"
            },
            {
              "name": "/contentId",
              "support": "required"
            },
            {
              "name": "/contentSha256",
              "support": "required"
            },
            {
              "name": "/locale",
              "support": "required"
            },
            {
              "name": "/license",
              "support": "required"
            },
            {
              "name": "/attribution",
              "support": "required"
            },
            {
              "name": "/source",
              "support": "required"
            },
            {
              "name": "/title",
              "support": "required"
            },
            {
              "name": "/excerpt",
              "support": "required"
            }
          ],
          "revision": "79f9c73596bd288b66d3e72ffbc22a382ee0c21b",
          "native_sources": [
            {
              "path": "site/guidance.mts",
              "sha256": "33d7a24390ea8f236ac4c3bd3a917697ddf90ea5c0e6f1c4de5986308c4c0474"
            },
            {
              "path": "site/guidance.json",
              "sha256": "73fb5afc23074dcfd62a44d7a8763d5d637bada1d2111b8cda3b3e7cbbaa8664"
            },
            {
              "path": "third-party/engineering/provenance.json",
              "sha256": "b8704bb09c38b608b230cc15149b656d383e5a639d4e367125226c1536218b5f"
            }
          ]
        }
      ]
    },
    {
      "id": "semantic-source-selection",
      "owner": "https://github.com/coela-oss/engineering",
      "native_sources": [
        {
          "path": "src/semantic.mts",
          "sha256": "b8abe093445634411663413d020be58b853ac41634f7dc8c82d0925eca8fadc0"
        },
        {
          "path": "integrations/semantic/source.json",
          "sha256": "0bcae88835062acd2033a8aa14a95c3a442a3c7b0232bfb909f07dc157bd27ce"
        },
        {
          "path": "integrations/semantic/evidence.sem",
          "sha256": "6736c2fc5fc6819f2baa9b403362b1b6873600f0abb96ae37ae2b10f723116da"
        }
      ],
      "identity": [
        "/id"
      ],
      "fields": [
        {
          "name": "/id",
          "type": "string",
          "required": true
        },
        {
          "name": "/version",
          "type": "string",
          "required": true
        },
        {
          "name": "/moduleSha256",
          "type": "string",
          "required": true
        },
        {
          "name": "/contentId",
          "type": "string",
          "required": true
        },
        {
          "name": "/contentVersion",
          "type": "string",
          "required": true
        },
        {
          "name": "/contentSha256",
          "type": "string",
          "required": true
        },
        {
          "name": "/catalogSha256",
          "type": "string",
          "required": true
        },
        {
          "name": "/termName",
          "type": "string",
          "required": true
        }
      ],
      "consumers": [
        {
          "id": "pinned-sem-lang-consumer",
          "owner": "https://github.com/coela-oss/engineering",
          "native_sources": [
            {
              "path": "acceptance/semantic/Cargo.toml",
              "sha256": "4c2a03dd5e27ef36015e03dc6a27027ca9886f275eb448ddc926ef9b91fb1846"
            },
            {
              "path": "acceptance/semantic/Cargo.lock",
              "sha256": "456bff66232bd9565b1824e71ad085a472b164ddb953b249a1d3fe1a327c4723"
            },
            {
              "path": "acceptance/semantic/src/lib.rs",
              "sha256": "f09a21c8c66d8d01e96f97e5ce8e1904c4600d479dca953b9e7c68d84af1d11c"
            },
            {
              "path": "acceptance/semantic/src/source.rs",
              "sha256": "cca0813eddb8b66970241f19eb926e9b3e6d4a04d2c2c4eca2f5f84394871733"
            },
            {
              "path": "acceptance/semantic/src/surface.rs",
              "sha256": "a491de1823d5fa4948a7179315c7651277d797b96fb9c51499e8864dc46e5f0b"
            },
            {
              "path": "acceptance/semantic/src/main.rs",
              "sha256": "be794517db700eda29675eb4c4bb67feafb71dcd955624efef9541d629dac02c"
            }
          ],
          "fields": [
            {
              "name": "/id",
              "support": "required"
            },
            {
              "name": "/version",
              "support": "required"
            },
            {
              "name": "/moduleSha256",
              "support": "required"
            },
            {
              "name": "/contentId",
              "support": "required"
            },
            {
              "name": "/contentVersion",
              "support": "required"
            },
            {
              "name": "/contentSha256",
              "support": "required"
            },
            {
              "name": "/catalogSha256",
              "support": "required"
            },
            {
              "name": "/termName",
              "support": "required"
            }
          ]
        }
      ]
    }
  ]
}
